{
	"$schema": "https://json-schema.org/draft/2020-12/schema",
	"$id": "https://github.com/blacktop/ipsw/pkg/signature/symbolicator",
	"$ref": "#/$defs/Symbolicator",
	"$defs": {
		"Anchor": {
			"properties": {
				"string": {
					"type": "string"
				},
				"segment": {
					"type": "string"
				},
				"section": {
					"type": "string"
				},
				"caller": {
					"oneOf": [
						{
							"type": "string"
						},
						{
							"type": "null"
						}
					]
				}
			},
			"additionalProperties": false,
			"type": "object",
			"required": [
				"string",
				"segment",
				"section"
			]
		},
		"Signature": {
			"properties": {
				"args": {
					"type": "integer"
				},
				"anchors": {
					"items": {
						"$ref": "#/$defs/Anchor"
					},
					"type": "array"
				},
				"symbol": {
					"type": "string"
				},
				"prototype": {
					"type": "string"
				},
				"backtrace": {
					"items": {
						"type": "string"
					},
					"type": "array"
				},
				"provenance": {
					"description": "Confidence source for the symbol; defaults to \"direct\" when absent.",
					"type": "string",
					"enum": [
						"direct",
						"dual-evidence",
						"propagated",
						"weak-string+callee"
					]
				}
			},
			"additionalProperties": false,
			"type": "object",
			"required": [
				"args",
				"anchors",
				"symbol",
				"prototype"
			]
		},
		"Symbolicator": {
			"properties": {
				"target": {
					"type": "string"
				},
				"total": {
					"type": "integer"
				},
				"version": {
					"$ref": "#/$defs/Version"
				},
				"signatures": {
					"items": {
						"$ref": "#/$defs/Signature"
					},
					"type": "array"
				}
			},
			"additionalProperties": false,
			"type": "object",
			"required": [
				"target",
				"total",
				"version",
				"signatures"
			]
		},
		"Version": {
			"properties": {
				"max": {
					"type": "string"
				},
				"min": {
					"type": "string"
				}
			},
			"additionalProperties": false,
			"type": "object",
			"required": [
				"max",
				"min"
			]
		}
	},
	"description": "ipsw Symbolicator definition file"
}
