{
    "target": "com.apple.driver.AppleAudioClockLibs",
    "total": 8,
    "version": {
        "max": "25.7.0",
        "min": "25.6.0"
    },
    "signatures": [
        {
            "args": 2,
            "anchors": [
                {
                    "string": "%s: Invalid key(%p) or devPath(%p).\n",
                    "segment": "__TEXT",
                    "section": "__cstring",
                    "caller": "__os_log_internal"
                },
                {
                    "string": "%s: Could not find registry entry for \"%s\"\n",
                    "segment": "__TEXT",
                    "section": "__cstring",
                    "caller": "__os_log_internal"
                },
                {
                    "string": "%s: Invalid key(%p) or devPath(%p).",
                    "segment": "__TEXT",
                    "section": "__os_log",
                    "caller": "__os_log_internal"
                },
                {
                    "string": "%s: Could not find registry entry for \"%s\"",
                    "segment": "__TEXT",
                    "section": "__os_log",
                    "caller": "__os_log_internal"
                }
            ],
            "symbol": "__ZN26AppleAudioDeviceTreeHelper11getPropertyEPKcS1_PK15IORegistryPlane",
            "prototype": "",
            "backtrace": [
                "__ZN26AppleAudioDeviceTreeHelper18getPropertyUint32tEPjPKcS2_PK15IORegistryPlane"
            ],
            "provenance": "direct"
        },
        {
            "args": 3,
            "anchors": [
                {
                    "string": "%s: Invalid value output argument.\n",
                    "segment": "__TEXT",
                    "section": "__cstring",
                    "caller": "__os_log_internal"
                },
                {
                    "string": "%s: \"%s/%s\" property data incompatible.\n",
                    "segment": "__TEXT",
                    "section": "__cstring",
                    "caller": "__os_log_internal"
                },
                {
                    "string": "%s: Invalid value output argument.",
                    "segment": "__TEXT",
                    "section": "__os_log",
                    "caller": "__os_log_internal"
                },
                {
                    "string": "%s: \"%s/%s\" property data incompatible.",
                    "segment": "__TEXT",
                    "section": "__os_log",
                    "caller": "__os_log_internal"
                }
            ],
            "symbol": "__ZN26AppleAudioDeviceTreeHelper18getPropertyUint32tEPjPKcS2_PK15IORegistryPlane",
            "prototype": "",
            "backtrace": [],
            "provenance": "direct"
        },
        {
            "args": 0,
            "anchors": [
                {
                    "string": "mach-time-audio-alignment",
                    "segment": "__TEXT",
                    "section": "__cstring",
                    "caller": "__ZN26AppleAudioDeviceTreeHelper18getPropertyUint32tEPjPKcS2_PK15IORegistryPlane"
                }
            ],
            "symbol": "__ZN15AppleAudioClock7Utility20getMachTimeAlignmentEv",
            "prototype": "",
            "backtrace": [
                "__ZN26AppleAudioDeviceTreeHelper18getPropertyUint32tEPjPKcS2_PK15IORegistryPlane"
            ],
            "provenance": "direct"
        },
        {
            "args": 0,
            "anchors": [
                {
                    "string": "usb-uses-audio-clock",
                    "segment": "__TEXT",
                    "section": "__cstring",
                    "caller": "__ZN26AppleAudioDeviceTreeHelper18getPropertyUint32tEPjPKcS2_PK15IORegistryPlane"
                }
            ],
            "symbol": "__ZN15AppleAudioClock7Utility20getUSBAudioAlignmentEv",
            "prototype": "",
            "backtrace": [
                "__ZN26AppleAudioDeviceTreeHelper18getPropertyUint32tEPjPKcS2_PK15IORegistryPlane"
            ],
            "provenance": "direct"
        },
        {
            "args": 0,
            "anchors": [
                {
                    "string": "mach-time-audio-max-drift",
                    "segment": "__TEXT",
                    "section": "__cstring",
                    "caller": "__ZN26AppleAudioDeviceTreeHelper18getPropertyUint32tEPjPKcS2_PK15IORegistryPlane"
                }
            ],
            "symbol": "__ZN15AppleAudioClock7Utility19getMachTimeMaxDriftEv",
            "prototype": "",
            "backtrace": [
                "__ZN26AppleAudioDeviceTreeHelper18getPropertyUint32tEPjPKcS2_PK15IORegistryPlane"
            ],
            "provenance": "direct"
        },
        {
            "args": 0,
            "anchors": [
                {
                    "string": "%s: nullptr for inController\n",
                    "segment": "__TEXT",
                    "section": "__cstring",
                    "caller": "__os_log_internal"
                },
                {
                    "string": "%s: %s type expect OSData got %s\n",
                    "segment": "__TEXT",
                    "section": "__cstring",
                    "caller": "__os_log_internal"
                },
                {
                    "string": "%s: %s property malformed, expected uint32\n",
                    "segment": "__TEXT",
                    "section": "__cstring",
                    "caller": "__os_log_internal"
                },
                {
                    "string": "%s: nullptr for inController",
                    "segment": "__TEXT",
                    "section": "__os_log",
                    "caller": "__os_log_internal"
                },
                {
                    "string": "%s: %s type expect OSData got %s",
                    "segment": "__TEXT",
                    "section": "__os_log",
                    "caller": "__os_log_internal"
                },
                {
                    "string": "%s: %s property malformed, expected uint32",
                    "segment": "__TEXT",
                    "section": "__os_log",
                    "caller": "__os_log_internal"
                }
            ],
            "symbol": "__ZN15AppleAudioClock7Utility22getClockDomainOverrideEPK9IOServicePKc",
            "prototype": "",
            "backtrace": [
                "__ZN15AppleAudioClock7Utility22getClockDomainOverrideEPK9IOService"
            ],
            "provenance": "direct"
        },
        {
            "args": 0,
            "anchors": [
                {
                    "string": "clock-domain",
                    "segment": "__TEXT",
                    "section": "__cstring",
                    "caller": "__ZN15AppleAudioClock7Utility22getClockDomainOverrideEPK9IOServicePKc"
                }
            ],
            "symbol": "__ZN15AppleAudioClock7Utility22getClockDomainOverrideEPK9IOService",
            "prototype": "",
            "backtrace": [
                "__ZN15AppleAudioClock7Utility22getClockDomainOverrideEPK9IOServicePKc"
            ],
            "provenance": "direct"
        }
    ]
}