{
    "target": "com.apple.driver.AppleA7IOP-AKFWrap-v4",
    "total": 16,
    "version": {
        "max": "28.0.0",
        "min": "27.0.0"
    },
    "signatures": [
        {
            "args": 0,
            "anchors": [
                {
                    "string": "mailboxItem != nullptr",
                    "segment": "__TEXT",
                    "section": "__cstring",
                    "caller": "_OUTLINED_FUNCTION_0"
                }
            ],
            "symbol": "__ZN12AppleA7IOPV414getMailboxBulkEPvPj.cold.2",
            "prototype": "",
            "backtrace": [
                "_panic",
                "_OUTLINED_FUNCTION_0",
                "__ZN12AppleA7IOPV414getMailboxBulkEPvPj"
            ],
            "provenance": "direct"
        },
        {
            "args": 0,
            "anchors": [
                {
                    "string": "mailboxItemCount != nullptr",
                    "segment": "__TEXT",
                    "section": "__cstring",
                    "caller": "_OUTLINED_FUNCTION_0"
                }
            ],
            "symbol": "__ZN12AppleA7IOPV414getMailboxBulkEPvPj.cold.1",
            "prototype": "",
            "backtrace": [
                "_panic",
                "_OUTLINED_FUNCTION_0",
                "__ZN12AppleA7IOPV414getMailboxBulkEPvPj"
            ],
            "provenance": "direct"
        },
        {
            "args": 2,
            "anchors": [
                {
                    "string": "AKF_RUNNING: False\n",
                    "segment": "__TEXT",
                    "section": "__cstring",
                    "caller": "_snprintf"
                },
                {
                    "string": "IDLE_STATUS: 0x%08x\nMAILBOX_SET: 0x%08x\nMAILBOX_CLR: 0x%08x\nINBOX_CTRL: 0x%08x\nOUTBOX_CTRL: 0x%08x\n",
                    "segment": "__TEXT",
                    "section": "__cstring",
                    "caller": "_snprintf"
                }
            ],
            "symbol": "__ZN12AppleA7IOPV424renderMailboxDebugStatusEPcm",
            "prototype": "",
            "backtrace": [
                "_snprintf"
            ],
            "provenance": "direct"
        },
        {
            "args": 0,
            "anchors": [
                {
                    "string": "virtual void AppleA7IOPV4::_mapFirmware(uint64_t, IOMemoryDescriptor *, IOOptionBits)",
                    "segment": "__TEXT",
                    "section": "__cstring",
                    "caller": "_OUTLINED_FUNCTION_0"
                },
                {
                    "string": "_isSingleRange(md)",
                    "segment": "__TEXT",
                    "section": "__cstring",
                    "caller": "_OUTLINED_FUNCTION_0"
                }
            ],
            "symbol": "__ZN12AppleA7IOPV412_mapFirmwareEyP18IOMemoryDescriptorj.cold.1",
            "prototype": "",
            "backtrace": [
                "_panic",
                "_OUTLINED_FUNCTION_0",
                "__ZN12AppleA7IOPV412_mapFirmwareEyP18IOMemoryDescriptorj"
            ],
            "provenance": "direct"
        },
        {
            "args": 0,
            "anchors": [
                {
                    "string": "\"%s\" @%s:%d",
                    "segment": "__TEXT",
                    "section": "__cstring",
                    "caller": "_panic"
                },
                {
                    "string": "OSBoundedPtr.h",
                    "segment": "__TEXT",
                    "section": "__cstring",
                    "caller": "_panic"
                }
            ],
            "symbol": "__ZN9os_detail21panic_trapping_policy4trapEPKc",
            "prototype": "",
            "backtrace": [
                "_panic",
                "__ZN12AppleA7IOPV422getMailboxDebugEntriesEv.cold.1",
                "__ZN12AppleA7IOPV422getMailboxDebugEntriesEv"
            ],
            "provenance": "direct"
        },
        {
            "args": 0,
            "anchors": [
                {
                    "string": "This bounded_ptr is pointing to memory outside of what can be represented by a native pointer.",
                    "segment": "__TEXT",
                    "section": "__cstring",
                    "caller": "__ZN9os_detail21panic_trapping_policy4trapEPKc"
                }
            ],
            "symbol": "__ZN12AppleA7IOPV422getMailboxDebugEntriesEv.cold.1",
            "prototype": "",
            "backtrace": [
                "_panic",
                "__ZN9os_detail21panic_trapping_policy4trapEPKc",
                "__ZN12AppleA7IOPV422getMailboxDebugEntriesEv"
            ],
            "provenance": "direct"
        },
        {
            "args": 0,
            "anchors": [
                {
                    "string": "virtual bool AppleA7IOPV4PMP::initialize()",
                    "segment": "__TEXT",
                    "section": "__cstring",
                    "caller": "_panic"
                }
            ],
            "symbol": "_OUTLINED_FUNCTION_0_0",
            "prototype": "",
            "backtrace": [
                "_panic"
            ],
            "provenance": "direct"
        },
        {
            "args": 0,
            "anchors": [
                {
                    "string": "_pmsCSRRegisterMap",
                    "segment": "__TEXT",
                    "section": "__cstring",
                    "caller": "_OUTLINED_FUNCTION_0_0"
                }
            ],
            "symbol": "__ZN15AppleA7IOPV4PMP10initializeEv.cold.2",
            "prototype": "",
            "backtrace": [
                "_panic",
                "_OUTLINED_FUNCTION_0_0",
                "__ZN15AppleA7IOPV4PMP10initializeEv"
            ],
            "provenance": "direct"
        },
        {
            "args": 0,
            "anchors": [
                {
                    "string": "_pmsCSRMappedRegs",
                    "segment": "__TEXT",
                    "section": "__cstring",
                    "caller": "_OUTLINED_FUNCTION_0_0"
                }
            ],
            "symbol": "__ZN15AppleA7IOPV4PMP10initializeEv.cold.1",
            "prototype": "",
            "backtrace": [
                "_panic",
                "_OUTLINED_FUNCTION_0_0",
                "__ZN15AppleA7IOPV4PMP10initializeEv"
            ],
            "provenance": "direct"
        },
        {
            "args": 0,
            "anchors": [],
            "symbol": "_snprintf",
            "prototype": "",
            "backtrace": [
                "__ZN12AppleA7IOPV424renderMailboxDebugStatusEPcm"
            ],
            "provenance": "propagated"
        },
        {
            "args": 1,
            "anchors": [],
            "symbol": "__ZN12AppleA7IOPV412_mapFirmwareEyP18IOMemoryDescriptorj",
            "prototype": "",
            "backtrace": [
                "__ZN12AppleA7IOPV412_mapFirmwareEyP18IOMemoryDescriptorj.cold.1"
            ],
            "provenance": "propagated"
        },
        {
            "args": 0,
            "anchors": [],
            "symbol": "_OUTLINED_FUNCTION_0",
            "prototype": "",
            "backtrace": [
                "__ZN12AppleA7IOPV412_mapFirmwareEyP18IOMemoryDescriptorj.cold.1"
            ],
            "provenance": "propagated"
        },
        {
            "args": 0,
            "anchors": [],
            "symbol": "_panic",
            "prototype": "",
            "backtrace": [
                "__ZN9os_detail21panic_trapping_policy4trapEPKc"
            ],
            "provenance": "propagated"
        },
        {
            "args": 0,
            "anchors": [],
            "symbol": "__ZN12AppleA7IOPV414getMailboxBulkEPvPj",
            "prototype": "",
            "backtrace": [
                "__ZN12AppleA7IOPV414getMailboxBulkEPvPj.cold.1"
            ],
            "provenance": "propagated"
        },
        {
            "args": 0,
            "anchors": [],
            "symbol": "__ZN15AppleA7IOPV4PMP10initializeEv",
            "prototype": "",
            "backtrace": [
                "__ZN15AppleA7IOPV4PMP10initializeEv.cold.2"
            ],
            "provenance": "propagated"
        },
        {
            "args": 0,
            "anchors": [],
            "symbol": "__ZN12AppleA7IOPV422getMailboxDebugEntriesEv",
            "prototype": "",
            "backtrace": [
                "__ZN12AppleA7IOPV422getMailboxDebugEntriesEv.cold.1"
            ],
            "provenance": "propagated"
        }
    ]
}