{
    "target": "com.apple.driver.AppleS8000DWI",
    "total": 8,
    "version": {
        "max": "28.0.0",
        "min": "27.0.0"
    },
    "signatures": [
        {
            "args": 0,
            "anchors": [
                {
                    "string": "dwi-version",
                    "segment": "__TEXT",
                    "section": "__cstring",
                    "caller": "__ZN15OSMetaClassBase12safeMetaCastEPKS_PK11OSMetaClass"
                },
                {
                    "string": "nclk-div",
                    "segment": "__TEXT",
                    "section": "__cstring",
                    "caller": "__ZN15OSMetaClassBase12safeMetaCastEPKS_PK11OSMetaClass"
                },
                {
                    "string": "polarity-config",
                    "segment": "__TEXT",
                    "section": "__cstring",
                    "caller": "__ZN15OSMetaClassBase12safeMetaCastEPKS_PK11OSMetaClass"
                },
                {
                    "string": "lockout-us",
                    "segment": "__TEXT",
                    "section": "__cstring",
                    "caller": "_snprintf"
                },
                {
                    "string": "str-delay",
                    "segment": "__TEXT",
                    "section": "__cstring",
                    "caller": "_snprintf"
                },
                {
                    "string": "soc-buck",
                    "segment": "__TEXT",
                    "section": "__cstring",
                    "caller": "_kprintf"
                },
                {
                    "string": "slave-select",
                    "segment": "__TEXT",
                    "section": "__cstring",
                    "caller": "_kprintf"
                },
                {
                    "string": "voltages-buck%x",
                    "segment": "__TEXT",
                    "section": "__cstring",
                    "caller": "_kprintf"
                },
                {
                    "string": "AppleS8000DWI::%s v%u _dwiBaseAddress: %#lx, buck mask = 0x%08x\n",
                    "segment": "__TEXT",
                    "section": "__cstring",
                    "caller": "_kprintf"
                },
                {
                    "string": "start",
                    "segment": "__TEXT",
                    "section": "__cstring",
                    "caller": "_kprintf"
                }
            ],
            "symbol": "__ZN13AppleS8000DWI5startEP9IOService",
            "prototype": "",
            "backtrace": [],
            "provenance": "direct"
        },
        {
            "args": 0,
            "anchors": [
                {
                    "string": "\"AppleS8000DWI::sendWLED: version: %x is unsupported\\n\" @%s:%d",
                    "segment": "__TEXT",
                    "section": "__cstring",
                    "caller": "_panic"
                }
            ],
            "symbol": "__ZN13AppleS8000DWI8sendWLEDEjbj",
            "prototype": "",
            "backtrace": [
                "__ZN30AppleS8000DWIBacklightFunction12callFunctionEPvS0_S0_"
            ],
            "provenance": "direct"
        },
        {
            "args": 0,
            "anchors": [
                {
                    "string": "\"AppleS5L8940DWI::_waitTransaction timeout for register %x\" @%s:%d",
                    "segment": "__TEXT",
                    "section": "__cstring",
                    "caller": "_panic"
                }
            ],
            "symbol": "__ZN13AppleS8000DWI16_waitTransactionEj",
            "prototype": "",
            "backtrace": [],
            "provenance": "direct"
        },
        {
            "args": 0,
            "anchors": [],
            "symbol": "__ZN30AppleS8000DWIBacklightFunction12callFunctionEPvS0_S0_",
            "prototype": "",
            "backtrace": [
                "__ZN13AppleS8000DWI8sendWLEDEjbj"
            ],
            "provenance": "propagated"
        }
    ]
}