{
    "target": "com.apple.driver.DiskImages.UDIFDiskImage",
    "total": 8,
    "version": {
        "max": "25.6.0",
        "min": "25.5.0"
    },
    "signatures": [
        {
            "args": 0,
            "anchors": [
                {
                    "string": "image-format-read-only",
                    "segment": "__TEXT",
                    "section": "__cstring",
                    "caller": null
                }
            ],
            "symbol": "__ZN16KDIUDIFDiskImage12_handleStartEP9IOService",
            "prototype": "",
            "backtrace": [],
            "provenance": "direct"
        },
        {
            "args": 0,
            "anchors": [
                {
                    "string": "cache-depth",
                    "segment": "__TEXT",
                    "section": "__cstring",
                    "caller": "__ZN15OSMetaClassBase12safeMetaCastEPKS_PK11OSMetaClass"
                }
            ],
            "symbol": "__ZN16KDIUDIFDiskImage11enableCacheEb",
            "prototype": "",
            "backtrace": [],
            "provenance": "direct"
        },
        {
            "args": 1,
            "anchors": [
                {
                    "string": "KDIUDIFCacheObject::cacheData: setLength failed\n",
                    "segment": "__TEXT",
                    "section": "__cstring",
                    "caller": "_IOLog"
                }
            ],
            "symbol": "__ZN18KDIUDIFCacheObject9cacheDataExxPKv",
            "prototype": "",
            "backtrace": [
                "__ZN16KDIUDIFDiskImage11readSectorsExxPxPvb"
            ],
            "provenance": "direct"
        },
        {
            "args": 0,
            "anchors": [
                {
                    "string": "KDIUDIFCacheObject: low on memory - deleting cache buffers",
                    "segment": "__TEXT",
                    "section": "__cstring",
                    "caller": "_IOLog"
                }
            ],
            "symbol": "__ZN18KDIUDIFCacheObject14commitHariKariEv",
            "prototype": "",
            "backtrace": [
                "__ZN16KDIUDIFDiskImage11readSectorsExxPxPvb"
            ],
            "provenance": "direct"
        },
        {
            "args": 0,
            "anchors": [
                {
                    "string": "## ? ...score.. ...age... ...use... ...start ... ...length...\n",
                    "segment": "__TEXT",
                    "section": "__cstring",
                    "caller": "_IOLog"
                },
                {
                    "string": "%2d %1.1s %+9qd %9qd %9qd %12qd %12qd\n",
                    "segment": "__TEXT",
                    "section": "__cstring",
                    "caller": "_IOLog"
                }
            ],
            "symbol": "__ZN18KDIUDIFCacheObject18displayCacheStatusEv",
            "prototype": "",
            "backtrace": [
                "__ZN18KDIUDIFCacheObject9cacheDataExxPKv",
                "__ZN16KDIUDIFDiskImage11readSectorsExxPxPvb"
            ],
            "provenance": "direct"
        },
        {
            "args": 0,
            "anchors": [],
            "symbol": "__ZN16KDIUDIFDiskImage11readSectorsExxPxPvb",
            "prototype": "",
            "backtrace": [
                "__ZN18KDIUDIFCacheObject14commitHariKariEv"
            ],
            "provenance": "propagated"
        }
    ]
}