{
    "target": "com.apple.driver.AppleVmxnet3Ethernet",
    "total": 13,
    "version": {
        "max": "25.7.0",
        "min": "25.6.0"
    },
    "signatures": [
        {
            "args": 1,
            "anchors": [
                {
                    "string": "local-mac-address",
                    "segment": "__TEXT",
                    "section": "__cstring",
                    "caller": "__ZN15OSMetaClassBase12safeMetaCastEPKS_PK11OSMetaClass"
                }
            ],
            "symbol": "__ZN21AppleVMXNETController5probeEP9IOServicePi",
            "prototype": "",
            "backtrace": [],
            "provenance": "direct"
        },
        {
            "args": 0,
            "anchors": [
                {
                    "string": "IONetworkStatsKey",
                    "segment": "__TEXT",
                    "section": "__cstring",
                    "caller": "_ifnet_set_tso_mtu"
                },
                {
                    "string": "IOEthernetStatsKey",
                    "segment": "__TEXT",
                    "section": "__cstring",
                    "caller": "__ZNK18IONetworkInterface12getParameterEPKc"
                }
            ],
            "symbol": "__ZN21AppleVMXNETController5startEP9IOService",
            "prototype": "",
            "backtrace": [],
            "provenance": "direct"
        },
        {
            "args": 0,
            "anchors": [
                {
                    "string": "IOInterfaceUnit",
                    "segment": "__TEXT",
                    "section": "__cstring",
                    "caller": "_printf"
                },
                {
                    "string": "WARNING: using bogus hardcoded station address\n",
                    "segment": "__TEXT",
                    "section": "__cstring",
                    "caller": "_printf"
                }
            ],
            "symbol": "__ZN21AppleVMXNETController18vmxnet3_get_lladdrEv",
            "prototype": "",
            "backtrace": [
                "__ZN21AppleVMXNETController5startEP9IOService"
            ],
            "provenance": "direct"
        },
        {
            "args": 0,
            "anchors": [
                {
                    "string": "hw.activecpu",
                    "segment": "__TEXT",
                    "section": "__cstring",
                    "caller": "_sysctlbyname"
                }
            ],
            "symbol": "__ZN21AppleVMXNETController17alloc_shared_dataEv",
            "prototype": "",
            "backtrace": [
                "__ZN21AppleVMXNETController5startEP9IOService"
            ],
            "provenance": "direct"
        },
        {
            "args": 0,
            "anchors": [
                {
                    "string": "Header alignment failed.!!!\n",
                    "segment": "__TEXT",
                    "section": "__cstring",
                    "caller": "_kprintf"
                },
                {
                    "string": "\nACK: genPhysicalSegments returned %d\n",
                    "segment": "__TEXT",
                    "section": "__cstring",
                    "caller": "_kprintf"
                }
            ],
            "symbol": "__ZN21AppleVMXNETController14setup_rx_queueEi",
            "prototype": "",
            "backtrace": [
                "__ZN21AppleVMXNETController15alloc_rx_queuesEv",
                "__ZN21AppleVMXNETController5startEP9IOService"
            ],
            "provenance": "direct"
        },
        {
            "args": 0,
            "anchors": [
                {
                    "string": "Failed to set polling paramters.!!!\n",
                    "segment": "__TEXT",
                    "section": "__cstring",
                    "caller": "_printf"
                }
            ],
            "symbol": "__ZN21AppleVMXNETController19vmxnet3_link_statusEv",
            "prototype": "",
            "backtrace": [],
            "provenance": "direct"
        },
        {
            "args": 1,
            "anchors": [],
            "symbol": "__ZN21AppleVMXNETController15alloc_rx_queuesEv",
            "prototype": "",
            "backtrace": [
                "__ZN21AppleVMXNETController14setup_rx_queueEi"
            ],
            "provenance": "propagated"
        }
    ]
}