{
    "target": "com.apple.driver.DiskImages.CryptoEncoding",
    "total": 6,
    "version": {
        "max": "25.4.0",
        "min": "25.3.0"
    },
    "signatures": [
        {
            "args": 0,
            "anchors": [
                {
                    "string": "hmacsha1-key",
                    "segment": "__TEXT",
                    "section": "__cstring",
                    "caller": "__ZN6KDIURL9getSecretEPKc"
                },
                {
                    "string": "encryption-key",
                    "segment": "__TEXT",
                    "section": "__cstring",
                    "caller": "_SHA1Update"
                }
            ],
            "symbol": "__ZN20KDIEncryptedEncoding13_loadContextsEv",
            "prototype": "",
            "backtrace": [
                "__ZN20KDIEncryptedEncoding12_handleStartEP9IOService"
            ],
            "provenance": "direct"
        },
        {
            "args": 0,
            "anchors": [
                {
                    "string": "KDIEncryptedEncoding: repairing file: backing store length %qd, expected %qd\n",
                    "segment": "__TEXT",
                    "section": "__cstring",
                    "caller": "_IOLog"
                },
                {
                    "string": "                    : REPAIR FAILED!\n",
                    "segment": "__TEXT",
                    "section": "__cstring",
                    "caller": "_IOLog"
                }
            ],
            "symbol": "__ZN20KDIEncryptedEncoding17_rationalizeSizesEv",
            "prototype": "",
            "backtrace": [],
            "provenance": "direct"
        },
        {
            "args": 1,
            "anchors": [],
            "symbol": "__ZN20KDIEncryptedEncoding12_handleStartEP9IOService",
            "prototype": "",
            "backtrace": [
                "__ZN20KDIEncryptedEncoding13_loadContextsEv"
            ],
            "provenance": "propagated"
        }
    ]
}