{
    "target": "com.apple.driver.AppleHollywood",
    "total": 3,
    "version": {
        "max": "28.0.0",
        "min": "27.2.0"
    },
    "signatures": [
        {
            "args": 0,
            "anchors": [
                {
                    "string": "CD Features Mask",
                    "segment": "__TEXT",
                    "section": "__cstring",
                    "caller": "__ZN15OSMetaClassBase12safeMetaCastEPKS_PK11OSMetaClass"
                },
                {
                    "string": "DVD Features Mask",
                    "segment": "__TEXT",
                    "section": "__cstring",
                    "caller": "__ZN15OSMetaClassBase12safeMetaCastEPKS_PK11OSMetaClass"
                },
                {
                    "string": "CD Features",
                    "segment": "__TEXT",
                    "section": "__cstring",
                    "caller": "__ZN9OSBoolean11withBooleanEb"
                },
                {
                    "string": "DVD Features",
                    "segment": "__TEXT",
                    "section": "__cstring",
                    "caller": "__ZN9OSBoolean11withBooleanEb"
                },
                {
                    "string": "Low Power Polling",
                    "segment": "__TEXT",
                    "section": "__cstring",
                    "caller": "__ZN15OSMetaClassBase12safeMetaCastEPKS_PK11OSMetaClass"
                },
                {
                    "string": "CD-DA support",
                    "segment": "__TEXT",
                    "section": "__cstring",
                    "caller": "__ZN15OSMetaClassBase12safeMetaCastEPKS_PK11OSMetaClass"
                }
            ],
            "symbol": "__ZN31com_apple_driver_AppleHollywood23DetermineDeviceFeaturesEv",
            "prototype": "",
            "backtrace": [],
            "provenance": "direct"
        }
    ]
}