{
    "target": "com.apple.AGXFirmwareKextG13GRTBuddy",
    "total": 18,
    "version": {
        "max": "28.0.0",
        "min": "27.0.0"
    },
    "signatures": [
        {
            "args": 0,
            "anchors": [
                {
                    "string": "AGXFirmwareKextG13RTBuddy",
                    "segment": "__TEXT",
                    "section": "__cstring",
                    "caller": "__ZN8OSSymbol17withCStringNoCopyEPKc"
                }
            ],
            "symbol": "__GLOBAL__sub_I_agxp_kext_g13_rtbuddy.cpp",
            "prototype": "",
            "backtrace": [],
            "provenance": "direct"
        },
        {
            "args": 0,
            "anchors": [
                {
                    "string": "AGXRTBuddyMessageWorkLoop",
                    "segment": "__TEXT",
                    "section": "__cstring",
                    "caller": "_thread_set_thread_name"
                }
            ],
            "symbol": "__ZN22AGXFirmwareKextRTBuddy5startEP9IOService",
            "prototype": "",
            "backtrace": [],
            "provenance": "direct"
        },
        {
            "args": 0,
            "anchors": [
                {
                    "string": "coredump-copy-buffer",
                    "segment": "__TEXT",
                    "section": "__cstring",
                    "caller": "__ZN15OSMetaClassBase12safeMetaCastEPKS_PK11OSMetaClass"
                }
            ],
            "symbol": "__ZNK22AGXFirmwareKextRTBuddy32getCoredumpCopyBufferEDTPropertyEv",
            "prototype": "",
            "backtrace": [
                "__ZN15OSMetaClassBase12safeMetaCastEPKS_PK11OSMetaClass"
            ],
            "provenance": "direct"
        },
        {
            "args": 0,
            "anchors": [
                {
                    "string": "AGXk: %s:%d:%s: !!! GFX firmware was not loaded by iBoot\n",
                    "segment": "__TEXT",
                    "section": "__cstring",
                    "caller": "_panic"
                },
                {
                    "string": "Endpoint1",
                    "segment": "__TEXT",
                    "section": "__cstring",
                    "caller": "_strlcpy"
                },
                {
                    "string": "Endpoint2",
                    "segment": "__TEXT",
                    "section": "__cstring",
                    "caller": "_strlcpy"
                }
            ],
            "symbol": "__ZN22AGXFirmwareKextRTBuddy12bootFirmwareEP11IOMemoryMap",
            "prototype": "",
            "backtrace": [],
            "provenance": "direct"
        },
        {
            "args": 0,
            "anchors": [
                {
                    "string": "AGXk: %s:%d:%s: !!! Power state change to Sleep did not complete!\n",
                    "segment": "__TEXT",
                    "section": "__cstring",
                    "caller": "_panic"
                },
                {
                    "string": "AGXk: %s:%d:%s: !!! Scheduler work queues disabled but command submission is still enabled\n",
                    "segment": "__TEXT",
                    "section": "__cstring",
                    "caller": "_panic"
                }
            ],
            "symbol": "__ZN22AGXFirmwareKextRTBuddy16powerStateChangeEmm",
            "prototype": "",
            "backtrace": [],
            "provenance": "direct"
        },
        {
            "args": 0,
            "anchors": [
                {
                    "string": "AGXk: %s:%d:%s: !!! Error, trying to change power state with disabled fender power management!\n",
                    "segment": "__TEXT",
                    "section": "__cstring",
                    "caller": "_panic"
                }
            ],
            "symbol": "__ZN22AGXFirmwareKextRTBuddy21powerStateChangeGatedEmm",
            "prototype": "",
            "backtrace": [
                "_panic"
            ],
            "provenance": "direct"
        },
        {
            "args": 0,
            "anchors": [],
            "symbol": "_panic",
            "prototype": "",
            "backtrace": [
                "__ZN22AGXFirmwareKextRTBuddy21powerStateChangeGatedEmm"
            ],
            "provenance": "propagated"
        },
        {
            "args": 0,
            "anchors": [],
            "symbol": "__ZN15OSMetaClassBase12safeMetaCastEPKS_PK11OSMetaClass",
            "prototype": "",
            "backtrace": [
                "__ZNK22AGXFirmwareKextRTBuddy32getCoredumpCopyBufferEDTPropertyEv"
            ],
            "provenance": "propagated"
        },
        {
            "args": 0,
            "anchors": [
                {
                    "string": "virtual const char *AGXFirmwareKextG13RTBuddy::getVersion(AGFIFirmwareRole)",
                    "segment": "__TEXT",
                    "section": "__cstring",
                    "caller": "_panic"
                }
            ],
            "symbol": "__ZN25AGXFirmwareKextG13RTBuddy10getVersionE16AGFIFirmwareRole",
            "prototype": "",
            "backtrace": [],
            "provenance": "dual-evidence"
        },
        {
            "args": 0,
            "anchors": [
                {
                    "string": "virtual bool AGXFirmwareKextG13RTBuddy::requestFirmwareBinary(const uint8_t **, size_t *, const AGXGPUCoreConfig &, AGFIFirmwareRole)",
                    "segment": "__TEXT",
                    "section": "__cstring",
                    "caller": "_panic"
                }
            ],
            "symbol": "__ZN25AGXFirmwareKextG13RTBuddy21requestFirmwareBinaryEPPKhPmRK16AGXGPUCoreConfig16AGFIFirmwareRole",
            "prototype": "",
            "backtrace": [],
            "provenance": "dual-evidence"
        },
        {
            "args": 0,
            "anchors": [
                {
                    "string": "virtual uint32_t AGXFirmwareKextG13RTBuddy::getBootConfigOffset(AGFIFirmwareRole)",
                    "segment": "__TEXT",
                    "section": "__cstring",
                    "caller": "_panic"
                }
            ],
            "symbol": "__ZN25AGXFirmwareKextG13RTBuddy19getBootConfigOffsetE16AGFIFirmwareRole",
            "prototype": "",
            "backtrace": [],
            "provenance": "dual-evidence"
        },
        {
            "args": 0,
            "anchors": [
                {
                    "string": "virtual uint32_t AGXFirmwareKextG13RTBuddy::getFWResumeFlagOffset(AGFIFirmwareRole)",
                    "segment": "__TEXT",
                    "section": "__cstring",
                    "caller": "_panic"
                }
            ],
            "symbol": "__ZN25AGXFirmwareKextG13RTBuddy21getFWResumeFlagOffsetE16AGFIFirmwareRole",
            "prototype": "",
            "backtrace": [],
            "provenance": "dual-evidence"
        },
        {
            "args": 0,
            "anchors": [
                {
                    "string": "virtual uint32_t AGXFirmwareKextG13RTBuddy::getFWPdumpBinPatchDataOffset(AGFIFirmwareRole)",
                    "segment": "__TEXT",
                    "section": "__cstring",
                    "caller": "_panic"
                }
            ],
            "symbol": "__ZN25AGXFirmwareKextG13RTBuddy28getFWPdumpBinPatchDataOffsetE16AGFIFirmwareRole",
            "prototype": "",
            "backtrace": [],
            "provenance": "dual-evidence"
        },
        {
            "args": 0,
            "anchors": [
                {
                    "string": "virtual size_t AGXFirmwareKextG13RTBuddy::getRuntimeBinSize(AGFIFirmwareRole)",
                    "segment": "__TEXT",
                    "section": "__cstring",
                    "caller": "_panic"
                }
            ],
            "symbol": "__ZN25AGXFirmwareKextG13RTBuddy17getRuntimeBinSizeE16AGFIFirmwareRole",
            "prototype": "",
            "backtrace": [],
            "provenance": "dual-evidence"
        },
        {
            "args": 0,
            "anchors": [
                {
                    "string": "virtual const char *AGXFirmwareKextG13RTBuddy::getBuild(AGFIFirmwareRole)",
                    "segment": "__TEXT",
                    "section": "__cstring",
                    "caller": "_panic"
                }
            ],
            "symbol": "__ZN25AGXFirmwareKextG13RTBuddy8getBuildE16AGFIFirmwareRole",
            "prototype": "",
            "backtrace": [],
            "provenance": "dual-evidence"
        }
    ]
}