{
    "target": "com.apple.driver.usb.AppleUSBCommon",
    "total": 19,
    "version": {
        "max": "28.0.0",
        "min": "27.2.0"
    },
    "signatures": [
        {
            "args": 1,
            "anchors": [
                {
                    "string": "%s-debug",
                    "segment": "__TEXT",
                    "section": "__cstring",
                    "caller": "_snprintf"
                },
                {
                    "string": "AppleUSBCommonDebug@%s-debug",
                    "segment": "__TEXT",
                    "section": "__cstring",
                    "caller": "_snprintf"
                }
            ],
            "symbol": "__ZN19AppleUSBCommonDebug31getDebugLoggingMaskForMetaClassEPK11OSMetaClassS2_PKc",
            "prototype": "",
            "backtrace": [
                "__ZN19AppleUSBRequestPool16initWithWorkLoopEP10IOWorkLoop"
            ],
            "provenance": "direct"
        },
        {
            "args": 0,
            "anchors": [
                {
                    "string": "com.apple.usb",
                    "segment": "__TEXT",
                    "section": "__cstring",
                    "caller": "_os_log_create"
                },
                {
                    "string": "debug",
                    "segment": "__TEXT",
                    "section": "__cstring",
                    "caller": "_os_log_create"
                },
                {
                    "string": "-restore",
                    "segment": "__TEXT",
                    "section": "__cstring",
                    "caller": "_PE_parse_boot_argn"
                },
                {
                    "string": "AppleUSBCommon-debug",
                    "segment": "__TEXT",
                    "section": "__cstring",
                    "caller": "_PE_parse_boot_argn"
                }
            ],
            "symbol": "__ZN27AppleUSBCommonDebugBootArgsC2Ev",
            "prototype": "",
            "backtrace": [],
            "provenance": "direct"
        },
        {
            "args": 0,
            "anchors": [
                {
                    "string": "%s: %s::%s: memory descriptor still set\n",
                    "segment": "__TEXT",
                    "section": "__cstring",
                    "caller": "_IOLog"
                }
            ],
            "symbol": "____ZN19AppleUSBRequestPool16returnDMACommandEP12IODMACommand_block_invoke",
            "prototype": "",
            "backtrace": [],
            "provenance": "direct"
        },
        {
            "args": 0,
            "anchors": [
                {
                    "string": "AppleUSBRequest.cpp",
                    "segment": "__TEXT",
                    "section": "__cstring",
                    "caller": "_panic"
                }
            ],
            "symbol": "____ZN19AppleUSBRequestPool16returnDMACommandEP12IODMACommand_block_invoke.cold.1",
            "prototype": "",
            "backtrace": [
                "_panic",
                "____ZN19AppleUSBRequestPool16returnDMACommandEP12IODMACommand_block_invoke"
            ],
            "provenance": "direct"
        },
        {
            "args": 0,
            "anchors": [
                {
                    "string": "usb_bundling_timeout",
                    "segment": "__TEXT",
                    "section": "__cstring",
                    "caller": "_PE_parse_boot_argn"
                }
            ],
            "symbol": "__ZN24AppleUSBRequestCompleter4initEP8OSObjectP10IOWorkLoopPFvS1_zE",
            "prototype": "",
            "backtrace": [
                "__ZN24AppleUSBRequestCompleter16requestCompleterEP8OSObjectP10IOWorkLoop"
            ],
            "provenance": "direct"
        },
        {
            "args": 0,
            "anchors": [
                {
                    "string": "%s: %s::%s: queues not empty\n",
                    "segment": "__TEXT",
                    "section": "__cstring",
                    "caller": "_IOLog"
                },
                {
                    "string": "%s: %s::%s: queues not empty\n",
                    "segment": "__TEXT",
                    "section": "__os_log",
                    "caller": "__os_log_internal"
                }
            ],
            "symbol": "__ZN24AppleUSBRequestCompleter4freeEv",
            "prototype": "",
            "backtrace": [],
            "provenance": "direct"
        },
        {
            "args": 0,
            "anchors": [
                {
                    "string": "AppleUSBRequestCompleter.cpp",
                    "segment": "__TEXT",
                    "section": "__cstring",
                    "caller": "_panic"
                }
            ],
            "symbol": "_OUTLINED_FUNCTION_0",
            "prototype": "",
            "backtrace": [
                "_panic"
            ],
            "provenance": "direct"
        },
        {
            "args": 0,
            "anchors": [
                {
                    "string": "%s: %s::%s: thread_call failed with 0x%08x",
                    "segment": "__TEXT",
                    "section": "__cstring",
                    "caller": "_IOLog"
                },
                {
                    "string": "%s: %s::%s: request completer mismatch\n",
                    "segment": "__TEXT",
                    "section": "__os_log",
                    "caller": "__os_log_internal"
                },
                {
                    "string": "%s: %s::%s: thread_call failed with 0x%08x",
                    "segment": "__TEXT",
                    "section": "__os_log",
                    "caller": "__os_log_internal"
                }
            ],
            "symbol": "__ZN24AppleUSBRequestCompleter14enqueueRequestEP15AppleUSBRequest",
            "prototype": "",
            "backtrace": [
                "__ZN24AppleUSBRequestCompleter20completeRequestChainEP15AppleUSBRequest"
            ],
            "provenance": "direct"
        },
        {
            "args": 0,
            "anchors": [
                {
                    "string": "%s: %s::%s: _queueSnapshot is not empty\n",
                    "segment": "__TEXT",
                    "section": "__cstring",
                    "caller": "_IOLog"
                },
                {
                    "string": "%s: %s::%s: _queueSnapshot is not empty\n",
                    "segment": "__TEXT",
                    "section": "__os_log",
                    "caller": "__os_log_internal"
                }
            ],
            "symbol": "__ZN24AppleUSBRequestCompleter12checkForWorkEv",
            "prototype": "",
            "backtrace": [],
            "provenance": "direct"
        },
        {
            "args": 0,
            "anchors": [
                {
                    "string": "%s: %s::%s: thread_call failed with 0x%08x\n",
                    "segment": "__TEXT",
                    "section": "__cstring",
                    "caller": "_IOLog"
                },
                {
                    "string": "%s: %s::%s: thread_call failed with 0x%08x\n",
                    "segment": "__TEXT",
                    "section": "__os_log",
                    "caller": "__os_log_internal"
                }
            ],
            "symbol": "__ZN24AppleUSBRequestCompleter20completeRequestQueueEP11queue_entry",
            "prototype": "",
            "backtrace": [],
            "provenance": "direct"
        },
        {
            "args": 1,
            "anchors": [],
            "symbol": "__ZN24AppleUSBRequestCompleter20completeRequestChainEP15AppleUSBRequest",
            "prototype": "",
            "backtrace": [
                "__ZN24AppleUSBRequestCompleter14enqueueRequestEP15AppleUSBRequest"
            ],
            "provenance": "propagated"
        },
        {
            "args": 0,
            "anchors": [],
            "symbol": "_panic",
            "prototype": "",
            "backtrace": [
                "____ZN19AppleUSBRequestPool16returnDMACommandEP12IODMACommand_block_invoke.cold.1"
            ],
            "provenance": "propagated"
        },
        {
            "args": 0,
            "anchors": [],
            "symbol": "__ZN19AppleUSBRequestPool16initWithWorkLoopEP10IOWorkLoop",
            "prototype": "",
            "backtrace": [
                "__ZN19AppleUSBCommonDebug31getDebugLoggingMaskForMetaClassEPK11OSMetaClassS2_PKc"
            ],
            "provenance": "propagated"
        },
        {
            "args": 0,
            "anchors": [],
            "symbol": "__ZN24AppleUSBRequestCompleter16requestCompleterEP8OSObjectP10IOWorkLoop",
            "prototype": "",
            "backtrace": [
                "__ZN24AppleUSBRequestCompleter4initEP8OSObjectP10IOWorkLoopPFvS1_zE"
            ],
            "provenance": "propagated"
        }
    ]
}