{
    "target": "com.apple.driver.AppleFileSystemDriver",
    "total": 12,
    "version": {
        "max": "28.0.0",
        "min": "27.0.0"
    },
    "signatures": [
        {
            "args": 0,
            "anchors": [
                {
                    "string": "RoleValue",
                    "segment": "__TEXT",
                    "section": "__cstring",
                    "caller": "__ZN15OSMetaClassBase12safeMetaCastEPKS_PK11OSMetaClass"
                }
            ],
            "symbol": "__ZN21AppleFileSystemDriver20getAPFSRoleForVolumeEP7IOMedia",
            "prototype": "",
            "backtrace": [
                "__ZN15OSMetaClassBase12safeMetaCastEPKS_PK11OSMetaClass"
            ],
            "provenance": "direct"
        },
        {
            "args": 0,
            "anchors": [
                {
                    "string": "VolGroupUUID",
                    "segment": "__TEXT",
                    "section": "__cstring",
                    "caller": "__ZN15OSMetaClassBase12safeMetaCastEPKS_PK11OSMetaClass"
                }
            ],
            "symbol": "__ZN21AppleFileSystemDriver21volumeMatchesAPFSUUIDEP7IOMediaP8OSStringb",
            "prototype": "",
            "backtrace": [],
            "provenance": "direct"
        },
        {
            "args": 0,
            "anchors": [
                {
                    "string": "AppleAPFSVolume",
                    "segment": "__TEXT",
                    "section": "__cstring",
                    "caller": "__ZN9IOService15serviceMatchingEPKcP12OSDictionary"
                }
            ],
            "symbol": "__ZN21AppleFileSystemDriver27startMatchingForAPFSVolumesEPFbPvS0_P9IOServiceP10IONotifierE",
            "prototype": "",
            "backtrace": [],
            "provenance": "direct"
        },
        {
            "args": 1,
            "anchors": [
                {
                    "string": "Content Hint",
                    "segment": "__TEXT",
                    "section": "__cstring",
                    "caller": "__ZN15OSMetaClassBase12safeMetaCastEPKS_PK11OSMetaClass"
                },
                {
                    "string": "Apple_HFS",
                    "segment": "__TEXT",
                    "section": "__cstring",
                    "caller": "_strcmp"
                },
                {
                    "string": "Apple_HFSX",
                    "segment": "__TEXT",
                    "section": "__cstring",
                    "caller": "_strcmp"
                },
                {
                    "string": "Apple_Boot",
                    "segment": "__TEXT",
                    "section": "__cstring",
                    "caller": "_strcmp"
                },
                {
                    "string": "Apple_Recovery",
                    "segment": "__TEXT",
                    "section": "__cstring",
                    "caller": "_strcmp"
                },
                {
                    "string": "48465300-0000-11AA-AA11-00306543ECAC",
                    "segment": "__TEXT",
                    "section": "__cstring",
                    "caller": "_strcmp"
                },
                {
                    "string": "426F6F74-0000-11AA-AA11-00306543ECAC",
                    "segment": "__TEXT",
                    "section": "__cstring",
                    "caller": "_strcmp"
                },
                {
                    "string": "5265636F-7665-11AA-AA11-00306543ECAC",
                    "segment": "__TEXT",
                    "section": "__cstring",
                    "caller": "_strcmp"
                }
            ],
            "symbol": "__ZN21AppleFileSystemDriver13checkBootUUIDEPvP9IOServiceP10IONotifier",
            "prototype": "",
            "backtrace": [],
            "provenance": "direct"
        },
        {
            "args": 0,
            "anchors": [
                {
                    "string": "media-match",
                    "segment": "__TEXT",
                    "section": "__cstring",
                    "caller": "__ZN15OSMetaClassBase12safeMetaCastEPKS_PK11OSMetaClass"
                },
                {
                    "string": "IOMedia",
                    "segment": "__TEXT",
                    "section": "__cstring",
                    "caller": "__ZN9IOService15serviceMatchingEPKcP12OSDictionary"
                }
            ],
            "symbol": "__ZN21AppleFileSystemDriver17startWithBootUUIDEP8OSObject",
            "prototype": "",
            "backtrace": [
                "__ZN21AppleFileSystemDriver5startEP9IOService"
            ],
            "provenance": "direct"
        },
        {
            "args": 0,
            "anchors": [
                {
                    "string": "/chosen",
                    "segment": "__TEXT",
                    "section": "__cstring",
                    "caller": "_IOLog"
                },
                {
                    "string": "apfs-preboot-uuid",
                    "segment": "__TEXT",
                    "section": "__cstring",
                    "caller": "_IOLog"
                },
                {
                    "string": "%s: using apfs-preboot-uuid\n",
                    "segment": "__TEXT",
                    "section": "__cstring",
                    "caller": "_IOLog"
                },
                {
                    "string": "associated-volume-group",
                    "segment": "__TEXT",
                    "section": "__cstring",
                    "caller": "_IOLog"
                },
                {
                    "string": "%s: using associated-volume-group\n",
                    "segment": "__TEXT",
                    "section": "__cstring",
                    "caller": "_IOLog"
                },
                {
                    "string": "%s: using %s\n",
                    "segment": "__TEXT",
                    "section": "__cstring",
                    "caller": "_IOLog"
                },
                {
                    "string": "%s: error getting boot-uuid property\n",
                    "segment": "__TEXT",
                    "section": "__cstring",
                    "caller": "_IOLog"
                }
            ],
            "symbol": "__ZN21AppleFileSystemDriver5startEP9IOService",
            "prototype": "",
            "backtrace": [],
            "provenance": "direct"
        },
        {
            "args": 0,
            "anchors": [
                {
                    "string": "BSD Name",
                    "segment": "__TEXT",
                    "section": "__cstring",
                    "caller": "_IOLog"
                },
                {
                    "string": "unknown",
                    "segment": "__TEXT",
                    "section": "__cstring",
                    "caller": "_IOLog"
                },
                {
                    "string": "%s: publishing %s=%s (%s)\n",
                    "segment": "__TEXT",
                    "section": "__cstring",
                    "caller": "_IOLog"
                },
                {
                    "string": "boot-uuid-media",
                    "segment": "__TEXT",
                    "section": "__cstring",
                    "caller": "_IOLog"
                }
            ],
            "symbol": "__ZN21AppleFileSystemDriver28publishBootMediaAndTerminateEP7IOMedia",
            "prototype": "",
            "backtrace": [],
            "provenance": "direct"
        },
        {
            "args": 1,
            "anchors": [
                {
                    "string": "%s: Invalid UUID string input\n",
                    "segment": "__TEXT",
                    "section": "__cstring",
                    "caller": "_IOLog"
                },
                {
                    "string": "%s: Invalid UUID string '%s'\n",
                    "segment": "__TEXT",
                    "section": "__cstring",
                    "caller": "_IOLog"
                }
            ],
            "symbol": "__ZL26createUUIDStringFromObjectPKcP8OSObjectPh",
            "prototype": "",
            "backtrace": [],
            "provenance": "direct"
        },
        {
            "args": 0,
            "anchors": [],
            "symbol": "__ZN15OSMetaClassBase12safeMetaCastEPKS_PK11OSMetaClass",
            "prototype": "",
            "backtrace": [
                "__ZN21AppleFileSystemDriver20getAPFSRoleForVolumeEP7IOMedia"
            ],
            "provenance": "propagated"
        }
    ]
}