{
    "target": "com.apple.driver.Apple16X50ACPI",
    "total": 5,
    "version": {
        "max": "25.7.0",
        "min": "25.6.0"
    },
    "signatures": [
        {
            "args": 1,
            "anchors": [
                {
                    "string": "Apple16X50ACPI: Attached to non-IOACPIPlatformDevice provider!  Failing probe()\n",
                    "segment": "__TEXT",
                    "section": "__cstring",
                    "caller": "_IOLog"
                },
                {
                    "string": "debug",
                    "segment": "__TEXT",
                    "section": "__cstring",
                    "caller": "_snprintf"
                },
                {
                    "string": "ACPI Device=%s",
                    "segment": "__TEXT",
                    "section": "__cstring",
                    "caller": "_snprintf"
                },
                {
                    "string": "IOTTYBaseName",
                    "segment": "__TEXT",
                    "section": "__cstring",
                    "caller": "_snprintf"
                },
                {
                    "string": "serial",
                    "segment": "__TEXT",
                    "section": "__cstring",
                    "caller": "_snprintf"
                },
                {
                    "string": "Built-in Serial Port",
                    "segment": "__TEXT",
                    "section": "__cstring",
                    "caller": "_snprintf"
                },
                {
                    "string": "Apple16X50ACPI%d",
                    "segment": "__TEXT",
                    "section": "__cstring",
                    "caller": "_snprintf"
                }
            ],
            "symbol": "__ZN26com_apple_driver_16X50ACPI5probeEP9IOServicePi",
            "prototype": "",
            "backtrace": [],
            "provenance": "direct"
        },
        {
            "args": 0,
            "anchors": [
                {
                    "string": "%s Base=0x%x",
                    "segment": "__TEXT",
                    "section": "__cstring",
                    "caller": "_snprintf"
                }
            ],
            "symbol": "__ZN26com_apple_driver_16X50ACPI9probeUARTEPvP30com_apple_driver_16X50UARTSyncP12OSDictionary",
            "prototype": "",
            "backtrace": [],
            "provenance": "direct"
        },
        {
            "args": 0,
            "anchors": [
                {
                    "string": "%s: Identified Serial Port on %s\n",
                    "segment": "__TEXT",
                    "section": "__cstring",
                    "caller": "_IOLog"
                },
                {
                    "string": "AAPL,connector",
                    "segment": "__TEXT",
                    "section": "__cstring",
                    "caller": "_IOLog"
                },
                {
                    "string": "Apple16X50ACPI::start FOUND DB9 Property for AAPL,connector\n",
                    "segment": "__TEXT",
                    "section": "__cstring",
                    "caller": "_IOLog"
                }
            ],
            "symbol": "__ZN26com_apple_driver_16X50ACPI5startEP9IOService",
            "prototype": "",
            "backtrace": [],
            "provenance": "direct"
        }
    ]
}