{
    "target": "com.apple.driver.AppleThunderboltUSBType2DownAdapter",
    "total": 12,
    "version": {
        "max": "25.7.0",
        "min": "25.6.0"
    },
    "signatures": [
        {
            "args": 1,
            "anchors": [
                {
                    "string": "tbusb",
                    "segment": "__TEXT",
                    "section": "__cstring",
                    "caller": "_kprintf"
                },
                {
                    "string": "%lldus AppleThunderboltUSBType2DownAdapter(%x@%llx:%x)::start bootargs=0x%x\n",
                    "segment": "__TEXT",
                    "section": "__cstring",
                    "caller": "_kprintf"
                },
                {
                    "string": "%lldus AppleThunderboltUSBType2DownAdapter(%x@%llx:%x)::start\n",
                    "segment": "__TEXT",
                    "section": "__os_log",
                    "caller": "_kprintf"
                },
                {
                    "string": "%lldus AppleThunderboltUSBType2DownAdapter(%x@%llx:%x)::start - status = 0x%08x\n",
                    "segment": "__TEXT",
                    "section": "__os_log",
                    "caller": "__os_log_internal"
                }
            ],
            "symbol": "__ZN35AppleThunderboltUSBType2DownAdapter5startEP9IOService",
            "prototype": "",
            "backtrace": [],
            "provenance": "direct"
        },
        {
            "args": 0,
            "anchors": [
                {
                    "string": "%lldus AppleThunderboltUSBType2DownAdapter(%x@%llx:%x)::finalize\n",
                    "segment": "__TEXT",
                    "section": "__os_log",
                    "caller": "__os_log_internal"
                }
            ],
            "symbol": "__ZN35AppleThunderboltUSBType2DownAdapter8finalizeEj",
            "prototype": "",
            "backtrace": [],
            "provenance": "direct"
        },
        {
            "args": 0,
            "anchors": [
                {
                    "string": "%lldus AppleThunderboltUSBType2DownAdapter(%x@%llx:%x)::free\n",
                    "segment": "__TEXT",
                    "section": "__os_log",
                    "caller": "__os_log_internal"
                }
            ],
            "symbol": "__ZN35AppleThunderboltUSBType2DownAdapter4freeEv",
            "prototype": "",
            "backtrace": [],
            "provenance": "direct"
        },
        {
            "args": 0,
            "anchors": [
                {
                    "string": "%lldus AppleThunderboltUSBType2DownAdapter(%x@%llx:%x)::createResources status = 0x%x\n",
                    "segment": "__TEXT",
                    "section": "__os_log",
                    "caller": "__os_log_internal"
                }
            ],
            "symbol": "__ZN35AppleThunderboltUSBType2DownAdapter15createResourcesEv",
            "prototype": "",
            "backtrace": [],
            "provenance": "direct"
        },
        {
            "args": 0,
            "anchors": [
                {
                    "string": "%lldus AppleThunderboltUSBType2DownAdapter(%x@%llx:%x)::setThunderboltClient = %p success = %d\n",
                    "segment": "__TEXT",
                    "section": "__os_log",
                    "caller": "__os_log_internal"
                }
            ],
            "symbol": "__ZN35AppleThunderboltUSBType2DownAdapter20setThunderboltClientEP33AppleThunderboltUSBType2UpAdapter",
            "prototype": "",
            "backtrace": [],
            "provenance": "direct"
        },
        {
            "args": 0,
            "anchors": [
                {
                    "string": "%lldus AppleThunderboltUSBType2DownAdapter(%x@%llx:%x)::lateSleep\n",
                    "segment": "__TEXT",
                    "section": "__os_log",
                    "caller": "__os_log_internal"
                }
            ],
            "symbol": "__ZN35AppleThunderboltUSBType2DownAdapter9lateSleepEv",
            "prototype": "",
            "backtrace": [],
            "provenance": "direct"
        },
        {
            "args": 0,
            "anchors": [
                {
                    "string": "%lldus AppleThunderboltUSBType2DownAdapter(%x@%llx:%x)::earlyWake\n",
                    "segment": "__TEXT",
                    "section": "__os_log",
                    "caller": "__os_log_internal"
                }
            ],
            "symbol": "__ZN35AppleThunderboltUSBType2DownAdapter9earlyWakeEv",
            "prototype": "",
            "backtrace": [],
            "provenance": "direct"
        },
        {
            "args": 0,
            "anchors": [
                {
                    "string": "%lldus AppleThunderboltUSBType2DownAdapter(%x@%llx:%x)::enableAdapter - findCapability failed status=0x%08x\n",
                    "segment": "__TEXT",
                    "section": "__os_log",
                    "caller": "_kprintf"
                },
                {
                    "string": "%lldus AppleThunderboltUSBType2DownAdapter(%x@%llx:%x)::enableAdapter - enable = %d status=0x%08x transportPort=0x%x\n",
                    "segment": "__TEXT",
                    "section": "__os_log",
                    "caller": "__os_log_internal"
                }
            ],
            "symbol": "__ZN35AppleThunderboltUSBType2DownAdapter13enableAdapterEjb",
            "prototype": "",
            "backtrace": [],
            "provenance": "direct"
        },
        {
            "args": 0,
            "anchors": [
                {
                    "string": "%lldus AppleThunderboltUSBType2DownAdapter(%x@%llx:%x)::configureLinkCommandsAggregation - mask = 0x%lx status=0x%08x\n",
                    "segment": "__TEXT",
                    "section": "__os_log",
                    "caller": "__os_log_internal"
                }
            ],
            "symbol": "__ZN35AppleThunderboltUSBType2DownAdapter32configureLinkCommandsAggregationEj",
            "prototype": "",
            "backtrace": [],
            "provenance": "direct"
        },
        {
            "args": 0,
            "anchors": [
                {
                    "string": "%lldus AppleThunderboltUSBType2DownAdapter(%x@%llx:%x)::setBundleWeight0 - status=0x%08x\n",
                    "segment": "__TEXT",
                    "section": "__os_log",
                    "caller": "_kprintf"
                },
                {
                    "string": "%lldus AppleThunderboltUSBType2DownAdapter(%x@%llx:%x)::setBundleWeight - data = 0x%lx fPortCount = 0x%lx status=0x%08x\n",
                    "segment": "__TEXT",
                    "section": "__os_log",
                    "caller": "__os_log_internal"
                }
            ],
            "symbol": "__ZN35AppleThunderboltUSBType2DownAdapter15setBundleWeightEv",
            "prototype": "",
            "backtrace": [],
            "provenance": "direct"
        }
    ]
}