{
    "target": "com.apple.iokit.SCSITaskUserClient",
    "total": 10,
    "version": {
        "max": "28.0.0",
        "min": "27.2.0"
    },
    "signatures": [
        {
            "args": 0,
            "anchors": [
                {
                    "string": "IOMatchCategory",
                    "segment": "__TEXT",
                    "section": "__cstring",
                    "caller": "__ZN15OSMetaClassBase12safeMetaCastEPKS_PK11OSMetaClass"
                },
                {
                    "string": "Peripheral Device Type",
                    "segment": "__TEXT",
                    "section": "__cstring",
                    "caller": null
                }
            ],
            "symbol": "__ZN24SCSITaskUserClientIniter5startEP9IOService_0",
            "prototype": "",
            "backtrace": [],
            "provenance": "direct"
        },
        {
            "args": 0,
            "anchors": [
                {
                    "string": "IOProviderMergeProperties",
                    "segment": "__TEXT",
                    "section": "__cstring",
                    "caller": null
                }
            ],
            "symbol": "_ZN18SCSITaskUserClientC2EPK11OSMetaClass",
            "prototype": "",
            "backtrace": [],
            "provenance": "direct"
        },
        {
            "args": 0,
            "anchors": [
                {
                    "string": "IOUserClientClass",
                    "segment": "__TEXT",
                    "section": "__cstring",
                    "caller": null
                }
            ],
            "symbol": "_ZN18SCSITaskUserClient9MetaClassC2Ev",
            "prototype": "",
            "backtrace": [],
            "provenance": "direct"
        },
        {
            "args": 0,
            "anchors": [
                {
                    "string": "IOCFPlugInTypes",
                    "segment": "__TEXT",
                    "section": "__cstring",
                    "caller": null
                }
            ],
            "symbol": "_ZN18SCSITaskUserClientnwEm",
            "prototype": "",
            "backtrace": [],
            "provenance": "direct"
        },
        {
            "args": 0,
            "anchors": [
                {
                    "string": "SCSITaskDeviceCategory",
                    "segment": "__TEXT",
                    "section": "__cstring",
                    "caller": null
                }
            ],
            "symbol": "_ZN18SCSITaskUserClientC2Ev",
            "prototype": "",
            "backtrace": [],
            "provenance": "direct"
        },
        {
            "args": 0,
            "anchors": [
                {
                    "string": "IOUserClientCrossEndianCompatible",
                    "segment": "__TEXT",
                    "section": "__cstring",
                    "caller": "_OUTLINED_FUNCTION_29_0"
                }
            ],
            "symbol": "__ZN18SCSITaskUserClient12initWithTaskEP4taskPvjP12OSDictionary_0",
            "prototype": "",
            "backtrace": [
                "_OUTLINED_FUNCTION_29_0"
            ],
            "provenance": "direct"
        },
        {
            "args": 1,
            "anchors": [
                {
                    "string": "SCSITaskUserClient - Invalid arguments: scatterGatherEntries = %d, requestedTransferCount = %qd, transfer direction is %d\n",
                    "segment": "__TEXT",
                    "section": "__cstring",
                    "caller": "_IOLog"
                }
            ],
            "symbol": "__ZN18SCSITaskUserClient15CompleteBuffersEP18IOMemoryDescriptor",
            "prototype": "",
            "backtrace": [],
            "provenance": "direct"
        },
        {
            "args": 0,
            "anchors": [],
            "symbol": "_OUTLINED_FUNCTION_29_0",
            "prototype": "",
            "backtrace": [
                "__ZN18SCSITaskUserClient12initWithTaskEP4taskPvjP12OSDictionary_0"
            ],
            "provenance": "propagated"
        }
    ]
}