{
    "target": "com.apple.private.KextAudit",
    "total": 8,
    "version": {
        "max": "25.4.0",
        "min": "25.3.0"
    },
    "signatures": [
        {
            "args": 0,
            "anchors": [
                {
                    "string": "terminate",
                    "segment": "__TEXT",
                    "section": "__cstring",
                    "caller": "_IOLog"
                }
            ],
            "symbol": "__ZN9KextAudit9terminateEj",
            "prototype": "",
            "backtrace": [
                "_IOLog"
            ],
            "provenance": "direct"
        },
        {
            "args": 0,
            "anchors": [
                {
                    "string": "IODeviceTree:/efi/platform",
                    "segment": "__TEXT",
                    "section": "__cstring",
                    "caller": "__ZN15IORegistryEntry8fromPathEPKcPK15IORegistryPlanePcPiPS_"
                },
                {
                    "string": "apple-coprocessor-version",
                    "segment": "__TEXT",
                    "section": "__cstring",
                    "caller": "__ZN15OSMetaClassBase12safeMetaCastEPKS_PK11OSMetaClass"
                }
            ],
            "symbol": "__ZN19KextAuditUserClient19getBridgeDeviceTypeEv",
            "prototype": "",
            "backtrace": [
                "__ZN19KextAuditUserClient12initWithTaskEP4taskPvjP12OSDictionary"
            ],
            "provenance": "direct"
        },
        {
            "args": 0,
            "anchors": [
                {
                    "string": "com.apple.private.KextAudit.user-access",
                    "segment": "__TEXT",
                    "section": "__cstring",
                    "caller": "__ZN12IOUserClient21copyClientEntitlementEP4taskPKc"
                }
            ],
            "symbol": "__ZN19KextAuditUserClient12initWithTaskEP4taskPvjP12OSDictionary",
            "prototype": "",
            "backtrace": [],
            "provenance": "direct"
        },
        {
            "args": 0,
            "anchors": [],
            "symbol": "_IOLog",
            "prototype": "",
            "backtrace": [
                "__ZN9KextAudit9terminateEj"
            ],
            "provenance": "propagated"
        },
        {
            "args": 0,
            "anchors": [
                {
                    "string": "%s called!?",
                    "segment": "__TEXT",
                    "section": "__cstring",
                    "caller": "_IOLog"
                }
            ],
            "symbol": "__ZN9KextAudit4stopEP9IOService",
            "prototype": "",
            "backtrace": [],
            "provenance": "weak-string+callee"
        }
    ]
}